Tỉnh,Quận,Trường
Tỉnh Bắc Giang,Huyện Hiệp Hòa,Trường Tiểu học Ngọc Sơn (24223401)
Tỉnh Bắc Giang,Huyện Hiệp Hòa,Trường Tiểu học Danh Thắng (24223402)
Tỉnh Bắc Giang,Huyện Hiệp Hòa,Trường Tiểu học Bắc Lý số 1 (24223403)
Tỉnh Bắc Giang,Huyện Hiệp Hòa,Trường Tiểu học Xuân Cẩm (24223404)
Tỉnh Bắc Giang,Huyện Hiệp Hòa,Trường Tiểu học Mai Trung số 1 (24223405)
Tỉnh Bắc Giang,Huyện Hiệp Hòa,Trường Tiểu học Mai Trung số 2 (24223406)
Tỉnh Bắc Giang,Huyện Hiệp Hòa,Trường Tiểu học Hợp Thịnh số 1 (24223407)
Tỉnh Bắc Giang,Huyện Hiệp Hòa,Trường Tiểu học Hương Lâm số 1 (24223408)
Tỉnh Bắc Giang,Huyện Hiệp Hòa,Trường Tiểu học Hương Lâm số 2 (24223409)
Tỉnh Bắc Giang,Huyện Hiệp Hòa,Trường Tiểu học Đông Lỗ số 1 (24223410)
Tỉnh Bắc Giang,Huyện Hiệp Hòa,Trường Tiểu học Đông Lỗ số 2 (24223411)
Tỉnh Bắc Giang,Huyện Hiệp Hòa,Trường Tiểu học Châu Minh (24223412)
Tỉnh Bắc Giang,Huyện Hiệp Hòa,Trường Tiểu học Mai Đình số 1 (24223413)
Tỉnh Bắc Giang,Huyện Hiệp Hòa,Trường Tiểu học Hoàng Vân (24223414)
Tỉnh Bắc Giang,Huyện Hiệp Hòa,Trường Tiểu học Thái Sơn (24223415)
Tỉnh Bắc Giang,Huyện Hiệp Hòa,Trường Tiểu học Hòa Sơn (24223416)
Tỉnh Bắc Giang,Huyện Hiệp Hòa,Trường Tiểu học Thường Thắng (24223417)
Tỉnh Bắc Giang,Huyện Hiệp Hòa,Trường Tiểu học Hoàng An (24223418)
Tỉnh Bắc Giang,Huyện Hiệp Hòa,Trường Tiểu học Lương Phong số 1 (24223419)
Tỉnh Bắc Giang,Huyện Hiệp Hòa,Trường Tiểu học Lương Phong số 2 (24223420)
Tỉnh Bắc Giang,Huyện Hiệp Hòa,Trường Tiểu học Hoàng Lương (24223421)
Tỉnh Bắc Giang,Huyện Hiệp Hòa,Trường Tiểu học Đức Thắng số 1 (24223422)
Tỉnh Bắc Giang,Huyện Hiệp Hòa,Trường Tiểu học Đức Thắng số 2 (24223423)
Tỉnh Bắc Giang,Huyện Hiệp Hòa,Trường Tiểu học Đoan Bái số 1 (24223424)
Tỉnh Bắc Giang,Huyện Hiệp Hòa,Trường Tiểu học Đoan Bái số 2 (24223425)
Tỉnh Bắc Giang,Huyện Hiệp Hòa,Trường Tiểu học Hoàng Thanh (24223426)
Tỉnh Bắc Giang,Huyện Hiệp Hòa,Trường Tiểu học Thanh Vân (24223428)
Tỉnh Bắc Giang,Huyện Hiệp Hòa,Trường Tiểu học Hùng Sơn (24223429)
Tỉnh Bắc Giang,Huyện Hiệp Hòa,Trường Tiểu học Thị trấn Thắng (24223430)
Tỉnh Bắc Giang,Huyện Hiệp Hòa,Trường Tiểu học Quang Minh (24223432)
Tỉnh Bắc Giang,Huyện Hiệp Hòa,Trường Tiểu học Bắc Lý số 2 (24223433)
Tỉnh Bắc Giang,Huyện Hiệp Hòa,Trường Tiểu học Hợp Thịnh số 2 (24223434)
Tỉnh Bắc Giang,Huyện Hiệp Hòa,Trường TH&THCS Đồng Tân (24223514)
Tỉnh Bắc Giang,Huyện Hiệp Hòa,Trường TH&THCS Đại Thành (24223524)
Tỉnh Bắc Giang,Huyện Hiệp Hòa,Trường TH&THCS Mai Đình (24223601)
Tỉnh Bắc Giang,Huyện Lạng Giang,Trường Tiểu học Tân Hưng (24217401)
Tỉnh Bắc Giang,Huyện Lạng Giang,Trường Tiểu học Xương Lâm (24217402)
Tỉnh Bắc Giang,Huyện Lạng Giang,Trường Tiểu học Hương Lạc (24217403)
Tỉnh Bắc Giang,Huyện Lạng Giang,Trường Tiểu học Tân Thanh (24217404)
Tỉnh Bắc Giang,Huyện Lạng Giang,Trường Tiểu học Tân Dĩnh (24217405)
Tỉnh Bắc Giang,Huyện Lạng Giang,Trường Tiểu học Thái Đào (24217406)
Tỉnh Bắc Giang,Huyện Lạng Giang,Trường Tiểu học Tiên Lục (24217407)
Tỉnh Bắc Giang,Huyện Lạng Giang,Trường Tiểu học An Hà (24217408)
Tỉnh Bắc Giang,Huyện Lạng Giang,Trường Tiểu học Quang Thịnh (24217409)
Tỉnh Bắc Giang,Huyện Lạng Giang,Trường Tiểu học thị trấn Vôi số 2 (24217410)
Tỉnh Bắc Giang,Huyện Lạng Giang,Trường Tiểu học Đại Lâm (24217411)
Tỉnh Bắc Giang,Huyện Lạng Giang,Trường Tiểu học Xuân Hương (24217413)
Tỉnh Bắc Giang,Huyện Lạng Giang,Trường Tiểu học Mỹ Thái (24217414)
Tỉnh Bắc Giang,Huyện Lạng Giang,Trường Tiểu học Dương Đức (24217415)
Tỉnh Bắc Giang,Huyện Lạng Giang,Trường Tiểu học Mỹ Hà (24217416)
Tỉnh Bắc Giang,Huyện Lạng Giang,Trường Tiểu học Đào Mỹ (24217417)
Tỉnh Bắc Giang,Huyện Lạng Giang,Trường Tiểu học Nghĩa Hưng (24217418)
Tỉnh Bắc Giang,Huyện Lạng Giang,Trường Tiểu học Nghĩa Hòa (24217419)
Tỉnh Bắc Giang,Huyện Lạng Giang,Trường Tiểu học TT Kép (24217420)
Tỉnh Bắc Giang,Huyện Lạng Giang,Trường Tiểu học Hương Sơn (24217421)
Tỉnh Bắc Giang,Huyện Lạng Giang,Trường Tiểu học thị trấn Vôi số 1 (24217423)
Tỉnh Bắc Giang,Huyện Lạng Giang,Trường Tiểu học Yên Mỹ. (24217424)
Tỉnh Bắc Giang,Huyện Lạng Giang,Trường TH&THCS Việt Hương (24217601)
Tỉnh Bắc Giang,Huyện Lục Nam,Trường Tiểu học Bảo Sơn (24218401)
Tỉnh Bắc Giang,Huyện Lục Nam,Trường Tiểu học Bảo Đài (24218403)
Tỉnh Bắc Giang,Huyện Lục Nam,Trường Tiểu học Bắc Lũng (24218404)
Tỉnh Bắc Giang,Huyện Lục Nam,Trường Tiểu học Cẩm Lý (24218405)
Tỉnh Bắc Giang,Huyện Lục Nam,Trường Tiểu học Tam Dị (24218406)
Tỉnh Bắc Giang,Huyện Lục Nam,Trường Tiểu học Thanh Lâm (24218409)
Tỉnh Bắc Giang,Huyện Lục Nam,Trường Tiểu học Yên Sơn. (24218410)
Tỉnh Bắc Giang,Huyện Lục Nam,Trường Tiểu học Đông Hưng (24218411)
Tỉnh Bắc Giang,Huyện Lục Nam,Trường Tiểu học Bình Sơn (24218413)
Tỉnh Bắc Giang,Huyện Lục Nam,Trường Tiểu học Lục Sơn (24218414)
Tỉnh Bắc Giang,Huyện Lục Nam,Trường Tiểu học Nghĩa Phương 1 (24218415)
Tỉnh Bắc Giang,Huyện Lục Nam,Trường Tiểu học Nghĩa Phương 2 (24218416)
Tỉnh Bắc Giang,Huyện Lục Nam,Trường Tiểu học Trường Sơn (24218418)
Tỉnh Bắc Giang,Huyện Lục Nam,Trường Tiểu học Vô Tranh 1 (24218419)
Tỉnh Bắc Giang,Huyện Lục Nam,Trường Tiểu học Vô Tranh 2 (24218420)
Tỉnh Bắc Giang,Huyện Lục Nam,Trường Tiểu học Đông Phú (24218421)
Tỉnh Bắc Giang,Huyện Lục Nam,Trường Tiểu học Đan Hội (24218423)
Tỉnh Bắc Giang,Huyện Lục Nam,Trường Tiểu học Cương Sơn (24218424)
Tỉnh Bắc Giang,Huyện Lục Nam,Trường Tiểu học Chu Điện (24218425)
Tỉnh Bắc Giang,Huyện Lục Nam,Trường Tiểu học Huyền Sơn (24218427)
Tỉnh Bắc Giang,Huyện Lục Nam,Trường Tiểu học Khám Lạng (24218428)
Tỉnh Bắc Giang,Huyện Lục Nam,Trường Tiểu học Lan Mẫu (24218429)
Tỉnh Bắc Giang,Huyện Lục Nam,Trường Tiểu học Phương Sơn (24218430)
Tỉnh Bắc Giang,Huyện Lục Nam,Trường Tiểu học Thị trấn Đồi Ngô số 1 (24218431)
Tỉnh Bắc Giang,Huyện Lục Nam,Trường Tiểu học Thị trấn Đồi Ngô số 2 (24218432)
Tỉnh Bắc Giang,Huyện Lục Nam,Trường Tiểu học Vũ Xá (24218435)
Tỉnh Bắc Giang,Huyện Lục Nam,Trường TH&THCS Tam Dị (24218513)
Tỉnh Bắc Giang,Huyện Lục Nam,Trường TH&THCS Tiên Nha (24218526)
Tỉnh Bắc Giang,Huyện Lục Nam,Trường TH&THCS Trường Giang (24218601)
Tỉnh Bắc Giang,Huyện Lục Nam,Trường TH&THCS TT Đồi Ngô (24218602)
Tỉnh Bắc Giang,Huyện Lục Nam,Trường TH&THCS Lục Sơn (24218603)
Tỉnh Bắc Giang,Huyện Lục Nam,Trường TH&THCS Bình Sơn (24218604)
Tỉnh Bắc Giang,Huyện Lục Ngạn,Trường Tiểu học Sa Lý (24219401)
Tỉnh Bắc Giang,Huyện Lục Ngạn,Trường Tiểu học Phong Vân (24219403)
Tỉnh Bắc Giang,Huyện Lục Ngạn,Trường Tiểu học Tân Sơn số 1 (24219404)
Tỉnh Bắc Giang,Huyện Lục Ngạn,Trường Tiểu học Tân Sơn số 2 (24219405)
Tỉnh Bắc Giang,Huyện Lục Ngạn,Trường Tiểu học Cấm Sơn (24219406)
Tỉnh Bắc Giang,Huyện Lục Ngạn,Trường Tiểu học Hộ Đáp (24219407)
Tỉnh Bắc Giang,Huyện Lục Ngạn,Trường Tiểu học Sơn Hải (24219408)
Tỉnh Bắc Giang,Huyện Lục Ngạn,Trường Tiểu học Đèo Gia (24219409)
Tỉnh Bắc Giang,Huyện Lục Ngạn,Trường Tiểu học Phú Nhuận (24219410)
Tỉnh Bắc Giang,Huyện Lục Ngạn,Trường Tiểu học Tân Lập (24219411)
Tỉnh Bắc Giang,Huyện Lục Ngạn,Trường tiểu học Tân Mộc (24219412)
Tỉnh Bắc Giang,Huyện Lục Ngạn,Trường Tiểu học Biển Động (24219414)
Tỉnh Bắc Giang,Huyện Lục Ngạn,Trường Tiểu học Đồng Cốc (24219415)
Tỉnh Bắc Giang,Huyện Lục Ngạn,Trường Tiểu học Giáp Sơn (24219416)
Tỉnh Bắc Giang,Huyện Lục Ngạn,Trường Tiểu học Kiên Lao (24219417)
Tỉnh Bắc Giang,Huyện Lục Ngạn,Trường Tiểu học Biên Sơn (24219418)
Tỉnh Bắc Giang,Huyện Lục Ngạn,Trường Tiểu học Thanh Hải số 1 (24219419)
Tỉnh Bắc Giang,Huyện Lục Ngạn,Trường Tiểu học Thanh Hải số 2 (24219420)
Tỉnh Bắc Giang,Huyện Lục Ngạn,Trường Tiểu học Trù Hựu (24219421)
Tỉnh Bắc Giang,Huyện Lục Ngạn,Trường Tiểu học Nam Dương (24219422)
Tỉnh Bắc Giang,Huyện Lục Ngạn,Trường Tiểu học Quý Sơn số 1 (24219423)
Tỉnh Bắc Giang,Huyện Lục Ngạn,Trường Tiểu học Quý Sơn số 2 (24219424)
Tỉnh Bắc Giang,Huyện Lục Ngạn,Trường Tiểu học Phượng Sơn (24219425)
Tỉnh Bắc Giang,Huyện Lục Ngạn,Trường Tiểu học Hồng Giang (24219427)
Tỉnh Bắc Giang,Huyện Lục Ngạn,Trường Tiểu học Thị trấn Chũ số 1 (24219429)
Tỉnh Bắc Giang,Huyện Lục Ngạn,Trường Tiểu học Kiên Thành (24219430)
Tỉnh Bắc Giang,Huyện Lục Ngạn,Trường Tiểu học Mỹ An (24219432)
Tỉnh Bắc Giang,Huyện Lục Ngạn,Trường Tiểu học Tân Hoa (24219433)
Tỉnh Bắc Giang,Huyện Lục Ngạn,Trường Tiểu học Phì Điền (24219434)
Tỉnh Bắc Giang,Huyện Lục Ngạn,Trường Tiểu học Thị trấn Chũ số 2 (24219435)
Tỉnh Bắc Giang,Huyện Lục Ngạn,Trường Tiểu học Tân Quang (24219436)
Tỉnh Bắc Giang,Huyện Lục Ngạn,Trường Tiểu học và THCS Phong Minh (24219601)
Tỉnh Bắc Giang,Huyện Lục Ngạn,Trường Tiểu học và THCS Kim Sơn (24219602)
Tỉnh Bắc Giang,Huyện Sơn Động,Trường Tiểu học An Bá (24220401)
Tỉnh Bắc Giang,Huyện Sơn Động,Trường Tiểu học An Châu (24220402)
Tỉnh Bắc Giang,Huyện Sơn Động,Trường Tiểu học An Lạc (24220403)
Tỉnh Bắc Giang,Huyện Sơn Động,Trường Tiểu học An Lập (24220404)
Tỉnh Bắc Giang,Huyện Sơn Động,Trường Tiểu học Cẩm Đàn (24220405)
Tỉnh Bắc Giang,Huyện Sơn Động,Trường Tiểu học Dương Hưu (24220406)
Tỉnh Bắc Giang,Huyện Sơn Động,Trường Tiểu học Giáo Liêm (24220407)
Tỉnh Bắc Giang,Huyện Sơn Động,Trường Tiểu học Lệ Viễn (24220408)
Tỉnh Bắc Giang,Huyện Sơn Động,Trường Tiểu học Long Sơn (24220409)
Tỉnh Bắc Giang,Huyện Sơn Động,Trường Tiểu học Thị trấn Thanh Sơn (24220410)
Tỉnh Bắc Giang,Huyện Sơn Động,Trường Tiểu học Thị trấn An Châu (24220411)
Tỉnh Bắc Giang,Huyện Sơn Động,Trường Tiểu học Tuấn Đạo (24220412)
Tỉnh Bắc Giang,Huyện Sơn Động,Trường Tiểu học Yên Định (24220413)
Tỉnh Bắc Giang,Huyện Sơn Động,Trường Tiểu học Quế Sơn (24220416)
Tỉnh Bắc Giang,Huyện Sơn Động,Trường Tiểu học Vân Sơn (24220418)
Tỉnh Bắc Giang,Huyện Sơn Động,Trường TH&THCS Chiên Sơn (24220504)
Tỉnh Bắc Giang,Huyện Sơn Động,Trường TH&THCS Thanh Luận (24220510)
Tỉnh Bắc Giang,Huyện Sơn Động,Trường TH&THCS Phúc Sơn 1 (24220515)
Tỉnh Bắc Giang,Huyện Sơn Động,Trường TH&THCS Hữu Sản (24220601)
Tỉnh Bắc Giang,Huyện Sơn Động,Trường TH&THCS Phúc Sơn 2 (24220602)
Tỉnh Bắc Giang,Huyện Sơn Động,Trường TH&THCS Vĩnh Khương (24220603)
Tỉnh Bắc Giang,Huyện Sơn Động,Trường TH&THCS Bồng Am (24220604)
Tỉnh Bắc Giang,Huyện Sơn Động,Trường TH&THCS Tuấn Mậu (24220605)
Tỉnh Bắc Giang,Huyện Tân Yên,Trường Tiểu học Việt Lập (24216401)
Tỉnh Bắc Giang,Huyện Tân Yên,Trường Tiểu học Tân Trung (24216402)
Tỉnh Bắc Giang,Huyện Tân Yên,Trường Tiểu học Song Vân (24216403)
Tỉnh Bắc Giang,Huyện Tân Yên,Trường Tiểu học Ngọc Vân (24216404)
Tỉnh Bắc Giang,Huyện Tân Yên,Trường Tiểu học Việt Ngọc (24216405)
Tỉnh Bắc Giang,Huyện Tân Yên,Trường Tiểu học Ngọc Thiện 1 (24216406)
Tỉnh Bắc Giang,Huyện Tân Yên,Trường Tiểu học Ngọc Thiện 2 (24216407)
Tỉnh Bắc Giang,Huyện Tân Yên,Trường Tiểu học Liên Chung (24216408)
Tỉnh Bắc Giang,Huyện Tân Yên,Trường Tiểu học Hợp Đức (24216409)
Tỉnh Bắc Giang,Huyện Tân Yên,Trường Tiểu học Phúc Hoà (24216410)
Tỉnh Bắc Giang,Huyện Tân Yên,Trường Tiểu học An Dương (24216411)
Tỉnh Bắc Giang,Huyện Tân Yên,Trường Tiểu học Nhã Nam (24216413)
Tỉnh Bắc Giang,Huyện Tân Yên,Trường Tiểu học Nguyên Hồng (24216414)
Tỉnh Bắc Giang,Huyện Tân Yên,Trường Tiểu học Phúc Sơn (24216415)
Tỉnh Bắc Giang,Huyện Tân Yên,Trường Tiểu học Lam Cốt (24216416)
Tỉnh Bắc Giang,Huyện Tân Yên,Trường Tiểu học Ngọc Châu (24216417)
Tỉnh Bắc Giang,Huyện Tân Yên,Trường Tiểu học Cao Xá (24216418)
Tỉnh Bắc Giang,Huyện Tân Yên,Trường Tiểu học Quế Nham (24216420)
Tỉnh Bắc Giang,Huyện Tân Yên,Trường Tiểu học Ngọc Lý (24216421)
Tỉnh Bắc Giang,Huyện Tân Yên,Trường Tiểu học Cao Thượng (24216422)
Tỉnh Bắc Giang,Huyện Tân Yên,Trường Tiểu học Liên Sơn (24216423)
Tỉnh Bắc Giang,Huyện Tân Yên,Trường Tiểu học Lan Giới (24216424)
Tỉnh Bắc Giang,Huyện Tân Yên,Trường Tiểu học Đại Hoá (24216425)
Tỉnh Bắc Giang,Huyện Tân Yên,Trường Tiểu học TT Cao Thượng (24216426)
Tỉnh Bắc Giang,Thành phố Bắc Giang,Trường Tiểu học Ngô Sĩ Liên (24213401)
Tỉnh Bắc Giang,Thành phố Bắc Giang,Trường Tiểu học Trần Phú (24213402)
Tỉnh Bắc Giang,Thành phố Bắc Giang,Trường Tiểu học Dĩnh Kế (24213403)
Tỉnh Bắc Giang,Thành phố Bắc Giang,Trường Tiểu học Võ Thị Sáu (24213404)
Tỉnh Bắc Giang,Thành phố Bắc Giang,Trường Tiểu học Đông Thành (24213405)
Tỉnh Bắc Giang,Thành phố Bắc Giang,Trường Tiểu học Lê Hồng Phong (24213406)
Tỉnh Bắc Giang,Thành phố Bắc Giang,Trường Tiểu học Song Mai (24213407)
Tỉnh Bắc Giang,Thành phố Bắc Giang,Trường Tiểu học Nam Hồng (24213408)
Tỉnh Bắc Giang,Thành phố Bắc Giang,Trường Tiểu học Minh Khai (24213409)
Tỉnh Bắc Giang,Thành phố Bắc Giang,Trường Tiểu học Đa Mai (24213410)
Tỉnh Bắc Giang,Thành phố Bắc Giang,Trường Tiểu học Lê Lợi (24213411)
Tỉnh Bắc Giang,Thành phố Bắc Giang,Trường Tiểu học Dĩnh Trì (24213412)
Tỉnh Bắc Giang,Thành phố Bắc Giang,Trường Tiểu học Tân Tiến (24213413)
Tỉnh Bắc Giang,Thành phố Bắc Giang,Trường Tiểu học Đồng Sơn (24213414)
Tỉnh Bắc Giang,Thành phố Bắc Giang,Trường Tiểu học Tân Mỹ (24213415)
Tỉnh Bắc Giang,Thành phố Bắc Giang,Trường Tiểu học Nguyễn Khắc Nhu (24213416)
Tỉnh Bắc Giang,Huyện Việt Yên,Trường Tiểu học Thượng Lan (24222401)
Tỉnh Bắc Giang,Huyện Việt Yên,Trường Tiểu học Hương Mai (24222405)
Tỉnh Bắc Giang,Huyện Việt Yên,Trường Tiểu học Bích Sơn (24222412)
Tỉnh Bắc Giang,Huyện Việt Yên,Trường Tiểu học Bích Động (24222413)
Tỉnh Bắc Giang,Huyện Việt Yên,Trường Tiểu học Tự Lạn (24222414)
Tỉnh Bắc Giang,Huyện Việt Yên,Trường Tiểu học Ninh Sơn (24222417)
Tỉnh Bắc Giang,Huyện Việt Yên,Trường Tiểu học Thị trấn Nếnh (24222421)
Tỉnh Bắc Giang,Huyện Việt Yên,Trường Tiểu học Vân Trung (24222423)
Tỉnh Bắc Giang,Huyện Việt Yên,Trường Tiểu học Hồng Thái (24222424)
Tỉnh Bắc Giang,Huyện Việt Yên,Trường Tiểu học Tăng Tiến (24222425)
Tỉnh Bắc Giang,Huyện Việt Yên,Trường Tiểu học Vân Hà (24222426)
Tỉnh Bắc Giang,Huyện Việt Yên,Trường Tiểu học Minh Đức (24222429)
Tỉnh Bắc Giang,Huyện Việt Yên,Trường Tiểu học Hoàng Ninh (24222430)
Tỉnh Bắc Giang,Huyện Việt Yên,Trường Tiểu học Nghĩa Trung (24222431)
Tỉnh Bắc Giang,Huyện Việt Yên,Trường Tiểu học Quang Châu (24222432)
Tỉnh Bắc Giang,Huyện Việt Yên,Trường Tiểu học Quảng Minh (24222433)
Tỉnh Bắc Giang,Huyện Việt Yên,Trường Tiểu học Tiên Sơn (24222434)
Tỉnh Bắc Giang,Huyện Việt Yên,Trường Tiểu học Trung Sơn (24222435)
Tỉnh Bắc Giang,Huyện Việt Yên,Trường Tiểu học Việt Tiến (24222436)
Tỉnh Bắc Giang,Huyện Yên Dũng,Trường Tiểu học Tiền Phong (24221401)
Tỉnh Bắc Giang,Huyện Yên Dũng,Trường Tiểu học Đồng Phúc (24221403)
Tỉnh Bắc Giang,Huyện Yên Dũng,Trường Tiểu học Hương Gián (24221404)
Tỉnh Bắc Giang,Huyện Yên Dũng,Trường Tiểu học Nội Hoàng (24221408)
Tỉnh Bắc Giang,Huyện Yên Dũng,Trường Tiểu học Yên Lư (24221409)
Tỉnh Bắc Giang,Huyện Yên Dũng,Trường Tiểu học Thị trấn Nham Biền số 2 (24221411)
Tỉnh Bắc Giang,Huyện Yên Dũng,Trường Tiểu học Thị trấn Nham Biền số 1 (24221412)
Tỉnh Bắc Giang,Huyện Yên Dũng,Trường Tiểu học Đồng Việt (24221413)
Tỉnh Bắc Giang,Huyện Yên Dũng,Trường Tiểu học Xuân Phú (24221414)
Tỉnh Bắc Giang,Huyện Yên Dũng,Trường Tiểu học Quỳnh Sơn (24221415)
Tỉnh Bắc Giang,Huyện Yên Dũng,Trường Tiểu học Lãng Sơn (24221416)
Tỉnh Bắc Giang,Huyện Yên Dũng,Trường Tiểu học Đức Giang (24221417)
Tỉnh Bắc Giang,Huyện Yên Dũng,Trường Tiểu học Tư Mại (24221418)
Tỉnh Bắc Giang,Huyện Yên Dũng,Trường Tiểu học Cảnh Thuỵ (24221419)
Tỉnh Bắc Giang,Huyện Yên Dũng,Trường Tiểu học Tiến Dũng (24221420)
Tỉnh Bắc Giang,Huyện Yên Dũng,Trường Tiểu học Trí Yên (24221421)
Tỉnh Bắc Giang,Huyện Yên Dũng,Trường Tiểu học Tân Liễu (24221423)
Tỉnh Bắc Giang,Huyện Yên Dũng,Trường Tiểu học Thị trấn Tân An (24221426)
Tỉnh Bắc Giang,Huyện Yên Dũng,Trường TH&THCS TTr Tân An. (24221511)
Tỉnh Bắc Giang,Huyện Yên Dũng,Trường TH&THCS Lão Hộ (24221523)
Tỉnh Bắc Giang,Huyện Yên Thế,Trường Tiểu học Xuân Lương (24215401)
Tỉnh Bắc Giang,Huyện Yên Thế,Trường Tiểu học Canh Nậu (24215402)
Tỉnh Bắc Giang,Huyện Yên Thế,Trường Tiểu học Tam Tiến (24215403)
Tỉnh Bắc Giang,Huyện Yên Thế,Trường Tiểu học Đồng Vương (24215404)
Tỉnh Bắc Giang,Huyện Yên Thế,Tiểu học Đồng Tiến (24215405)
Tỉnh Bắc Giang,Huyện Yên Thế,Trường Tiểu học An Thượng (24215406)
Tỉnh Bắc Giang,Huyện Yên Thế,Trường Tiểu học Tiến Thắng (24215407)
Tỉnh Bắc Giang,Huyện Yên Thế,Trường Tiểu học Đồng Kỳ (24215408)
Tỉnh Bắc Giang,Huyện Yên Thế,Trường Tiểu học Hương Vỹ (24215409)
Tỉnh Bắc Giang,Huyện Yên Thế,Trường Tiểu học Đông Sơn (24215410)
Tỉnh Bắc Giang,Huyện Yên Thế,Trường Tiểu học Đồng Hưu (24215411)
Tỉnh Bắc Giang,Huyện Yên Thế,Trường Tiểu học Tam Hiệp (24215412)
Tỉnh Bắc Giang,Huyện Yên Thế,Trường Tiểu học TT Phồn Xương (24215413)
Tỉnh Bắc Giang,Huyện Yên Thế,Trường Tiểu học Đồng Lạc. (24215416)
Tỉnh Bắc Giang,Huyện Yên Thế,Trường Tiểu học Tân Sỏi (24215417)
Tỉnh Bắc Giang,Huyện Yên Thế,Trường Tiểu học Hồng Kỳ (24215419)
Tỉnh Bắc Giang,Huyện Yên Thế,Trường Tiểu học TT Bố Hạ (24215420)
Tỉnh Bắc Giang,Huyện Yên Thế,Trường TH&THCS Tân Hiệp (24215508)
Tỉnh Bắc Giang,Huyện Yên Thế,Trường TH & THCS Đồng Tâm (24215601)